Essay Title,Human-Written,AI-Written,Type,
American Health Care System,"Health care is one of the most hectic issues that the United States has had to deal with for so many years. The leadership of the country has been under pressure in the recent years to try to establish a permanent solution to the health care problem. The country’s population is expanding and aging at the same on a daily basis. This population has been increasingly demanding inexpensive medical services to help it remain healthy.
To develop health care systems in the United States, its leaders should emulate other countries that have succeeded in the sector. The People’s Republic of China is one of those countries that have well-developed health care systems that adequately cater for the medical needs of their citizens. China, in particular, has a nationalized health care system that is controlled entirely by the government.
Although most Americans do not support the plan to adopt the Chinese health care system for fear that it may be manipulated by the government, the system offers a better solution to the health care problem in the U.S. If the Chinese system cannot be approved fully, at least it should be implemented partially.
Nevertheless, finding the best solution to the United States’ health care problem requires more than just adopting health care systems of other countries. Americans need a comprehensive and effective health care scheme that can solve their “present and future medical needs”.
The American health care system has evolved through several stages in many years. It can be traced from as far as mid 1700s when the earliest life insurance scheme was established in the country. However, proper health insurance plans came to existence in the 1850s, when Massachusetts, through the Franklin Health Assurance Company, began to offer accident insurance to its citizens.
The accident insurance scheme catered for injuries that were incurred as a result of steamboat transport hitches and railroad accidents. It was after the initiation of the Franklin Company that several plans emerged, which covered all the common types of injuries and sicknesses.
However, the main medical insurance schemes in America were established too late. The medical schemes were established from 1930 onwards. There are a number of reasons that prevented an early invention of the medical plans. One of the major reasons is “the poor quality of the health care that was offered at the time”.
The quality was so poor that the majority of Americans shunned hospitals terming them as unreliable. The schemes offered at the time were only meant to compensate the sick people for their inability to make money as they could not work. The schemes did not cover the “medical bills that people incurred in the hospital”.
The country’s medical system received major boost between 1900 and 1940. The health care scheme, for instance, incorporated several aspects, such as vaccines, diagnoses of infectious diseases, measures for blood pressure, and X-ray technology, into the system. These advancements were legitimized by the creation of medical regulations to guide the practices of physicians.
For instance, the American Medical Association, established the Council on Medical Education in 1904, to develop and implement medical standards through issuance of medical licenses. There occurred another step in 1913 after the Council on Medical Education was founded. The American College of Surgeons, a body that was supposed to regulate the accreditation of medical institution, came to existence. The college closed down by 1915 but more than 35 medical schools had been found to be unfit.
The modern day health care insurance plans sprang up in 1929 and in the early 1930s as a result of several factors. The first one was the increase of demand for medical services from the citizens. The second factor was the limited supply of medical equipment hospitals and the low number of health practitioners, which could not meet the high demand. As a result, “the medical cost increased so much that many citizens could not afford to pay for their medical services”.
Different personalities came up with different plans to cater for the country’s population. For example, Dr. Justin Ford Kimball is remembered for the part he played in the development of the modern health care system in 1929. Justin developed a system called the Baylor Plan, in which teachers were required to contribute 50 cents every month to cater for their medical services for a period of up to 21 days per year.
Many hospitals, after the occurrence of the Great Depression in 1930, were forced to begin offering medical plans to their clients and they adopted the Baylor Plan. The schemes, most of which were prepaid, not only enabled the subscribers to get affordable medical coverage, but it also enabled the hospitals to receive constant income in spite of the staggering state of economy at that time.
Toward the end of the 1940s, several private, commercial medical insurance plans had developed. The companies that offered the plan introduced premium charges based on the relative risk, which saw older people paying more than any other group. The Blue Shield and Blue Cross plans, which were by that time regarded as not-for-profit schemes, eventually began to charge premiums for fear of losing business to the commercial companies.
The presence of successful health care schemes in the 1950s kept the government from involving in the schemes. However, in 1965, the government intervened and introduced Medicaid and Medicare programs to complement the plans that were offered by the private sector.
In the late 1980s and early 1990s, a number of technologies were introduced into the medical field making the plans very expensive to the common citizens. The Congress responded by pushing for development of other schemes to cater for the poor. As a result of the Congress’ efforts, the Health Insurance Portability and Accountability Act and the Mental Health Parity Act came to existence in mid 1990s.
Before these plans that were enacted by the Congress, President Bill Clinton had made a proposal in 1993 to enact a universal medical plan in the country. However, Bill’s proposal was blocked before it could be implemented. President George Bush’s “attempts in 2003 to add more contents to the Medicare program were also thwarted”.
Since 2003, several attempts to develop a national health care system in the United States have been made by different personalities, but none of them has succeeded. There is a lot of politics in the medical field, which frustrates the development of some of the plans that seem to care for the poor.
As a result of the rising medical costs, “very many people in the United States remain uninsured”. For instance, a study conducted in 2007 by the U.S. Census of Bureau found that more than 15% of the country’s population was not covered by any medical plan. Before thinking about the best kind of health care plan to develop for the citizens, the personalities involved should keep politics aside.
","The American health care system is a complex and multifaceted entity that has been the subject of much debate and scrutiny in recent years. Despite being one of the wealthiest and most technologically advanced countries in the world, the United States has struggled to provide its citizens with affordable, accessible, and high-quality health care.


At the heart of the American health care system are private insurance companies, which are responsible for providing coverage to the vast majority of Americans. Private insurance is typically obtained through an employer or purchased individually, and it varies widely in terms of cost and coverage. While some Americans have access to comprehensive insurance plans that cover a range of medical services, others face high premiums, deductibles, and out-of-pocket expenses.


One of the most significant challenges facing the American health care system is the issue of affordability. Health care costs in the United States are among the highest in the world, and many Americans struggle to afford basic medical care. This is particularly true for individuals without insurance, who may be forced to pay out-of-pocket for medical services or go without care altogether. In addition, even those with insurance often face high out-of-pocket costs, such as deductibles and copays, which can be financially crippling for low- and middle-income families.


Another major issue with the American health care system is access. While most Americans have some form of health insurance, many still face significant barriers to accessing care. For example, individuals living in rural areas may not have access to medical facilities or providers, while those living in low-income areas may have limited options for medical care. Additionally, certain populations, such as undocumented immigrants, may be excluded from accessing health care services altogether.


The quality of care provided by the American health care system is also a matter of concern. While the United States has some of the most advanced medical technologies and facilities in the world, the quality of care varies widely depending on factors such as income, race, and geographic location. For example, individuals living in low-income areas or in areas with high rates of poverty may have limited access to high-quality medical care, leading to disparities in health outcomes.


In recent years, the American health care system has been the subject of significant political debate, particularly surrounding the Affordable Care Act (ACA), also known as Obamacare. The ACA, which was passed in 2010, aimed to expand access to health care coverage and reduce costs for millions of Americans. However, the law has been the subject of numerous legal challenges and attempts at repeal, and its long-term future remains uncertain.


One potential solution to the challenges facing the American health care system is a single-payer system, in which the government would be responsible for providing health insurance coverage to all citizens. This approach is used in many other countries, and proponents argue that it would reduce costs, improve access, and ensure that all Americans have access to high-quality health care. However, opponents argue that a single-payer system would be too costly, would limit patient choice, and would reduce innovation in the health care sector.


Another potential solution is to expand and improve upon the existing private insurance system. This could include measures such as reducing costs for low-income individuals, increasing competition among insurance providers, and implementing regulations to ensure that all insurance plans meet minimum standards for coverage and quality of care.


One thing that is clear is that the status quo is not working. Too many Americans are struggling to access the care they need, and too many are being forced to choose between their health and their financial stability. As the country continues to grapple with the COVID-19 pandemic, it has become even more apparent that a strong, resilient, and equitable health care system is essential to the well-being of all Americans.


One potential avenue for reform is a focus on preventative care and public health initiatives. By investing in programs and services that help individuals maintain their health and prevent chronic illnesses, the overall burden on the health care system could be reduced. This could include measures such as increasing access to healthy food options, promoting physical activity, and investing in community health centers and other resources that provide care to underserved populations.


Another important consideration is the role of technology in the health care system. Advances in telemedicine, artificial intelligence, and other technologies have the potential to transform the way health care is delivered, making it more efficient, cost-effective, and patient-centered. However, it is important to ensure that these technologies are accessible to all Americans, regardless of income or geographic location.


Ultimately, any meaningful reform of the American health care system will require a willingness to address the root causes of the problems facing the system, including income inequality, systemic racism, and the profit-driven nature of the health care industry. It will require a recognition that health care is a human right, and a commitment to ensuring that all Americans have access to the care they need to live healthy and productive lives.


In the end, the future of the American health care system will be shaped by the choices we make today. It will require a collective effort by policymakers, health care providers, and patients to build a system that truly puts the needs of the people first. By working together and embracing a spirit of innovation, compassion, and equity, we can create a health care system that reflects the best of American values and ensures that all Americans have the opportunity to live healthy, fulfilling lives.
",Expository,
What Is Good Writing?,"Good writing has been given various definitions by different people. Every individual understands the meaning of good writing in their unique ways and thus it has come to be an issue of controversy as to what good writing is. In my opinion, good writing is creative writing that directly responds to the reader’s interests, has captivating ideas, and begs the reader’s attention to continue reading. Good writing is subjective and depends on the writer and the reader. Writing is like an art. If the writer thinks it is good, it can be good writing, and if the reader thinks it is good it also can be good writing.

Ideas are the main part of writing and constitute the main reason for wanting to write in the first place.

According to Allen, good writing must have its ideas effectively organized and communicated to flow from one idea to the next one. Ideas are the main part of writing and constitute the main reason for wanting to write in the first place. Mostly, good writing is composed of the main idea which is the thesis statement and a whole lot of intriguing details that make the writing good. The main idea in writing must be of importance to the writer and audience and also be a sentence that can stand on its own.

These ideas and details must be organized in such a way that the writer has the beginning and the end. The author further asserts that a writer must come up with an introduction that stimulates the reader’s mind in a captivating manner. Also, the ideas must be arranged in a way that each leads to the other in a smooth and flowing mode. Finally, the conclusion must satisfactorily feel finished to the readers and should leave them with food for thought.

Good writing must have parts that are easy to follow; that is, they should use transitional phrases such as next, finally, then and so forth.

Just like any other task, writing is a process that requires preparation. Before a writer sits to put down the ideas, they must gather and organize those ideas by thinking and researching. The writer should then compare his or her opinions with those of others from the research. They also ought to plan, write, and finally proofread to ensure that their work has no errors whatsoever. Therefore, one must start by thinking of what they want to write about, whom they are writing for, and the kind of document they want to write.

Before a writer sits to put down their ideas, they must gather and organize those ideas by thinking and researching.

It is widely agreed upon that good writing should always be paraphrased, summarized, or quoted if taken from a particular source that should be credited. Universal understanding is also essential in good writing. The writers should be simple and clear in what they are conveying. Thus, complex words should be avoided and instead common English language that is understood by all should be used. Any writing that does not stick to all these points is considered to be bad.

Thinking and research precede writing; therefore, good writing depends upon one’s quality of research and critical thinking

As McClure puts it, thinking and research precede writing. Therefore, good writing depends on one’s quality of research and critical thinking. Ideas are developed in the mind and once one has given a clear thought of what they are going to write about and the intended audience, then one is ready to start. In the author’s view, it is essential to jot down ideas that come across one’s mind and also the main points from a source so as not to forget.

This will enable the writer to gather and organize the main ideas and draft them easily later. Critical thinking is vital during research as it helps one to differentiate between valuable and useful information for one’s writing from that which is not useful. It is also crucial because by thinking critically one can avoid trusting every information from a source as some facts stated in the source might be untrue.

However, the methods of finding and evaluating information keep changing from time to time. Most studies, for instance, have indicated that most researchers use the internet to do their research. Nevertheless, one should be cautious as information from some websites such as Wikipedia is not considered reliable. In as much as such websites are not advocated for research purposes, they are very important in doing preliminary research and seeking information. There are some reasons why these sites are not approved for academic research, and one of the reasons is that they lack accuracy and accountability. The information posted on these sites can be removed or altered at any time thus resulting in their unreliability.

After editing, one should proofread their work to weed out any spelling mistakes, grammatical errors, punctuation mistakes, and the correct choice of words.

Allen then advises that thorough research and clear thinking should be followed by the drafting process where one puts all the collected information into the paper. During the drafting stage, one should not be worried about many details as long as one’s writing follows the plan. Once one is finished with the draft, the next step is to reread and edit the draft to see if there are any errors. The best way to do this is to give someone to read and correct mistakes. After editing, one should proofread their work to weed out any spelling mistakes, grammatical errors, punctuation mistakes, and the correct choice of words. This can be done by oneself, but for it to be effective someone else who has not read the draft can be found to proofread the work.

In conclusion, a writer must always know the purpose of writing, putting the intended readers in mind. This will aid the author in writing a good piece of work thus making it enjoyable to read most especially and not limited to the targeted audience. Lastly, reading is the best way to determine great writing and a writer can determine if their work is good or poor.","Writing is a form of communication that has been essential to human existence since the beginning of time. From cave paintings to modern-day novels, writing has allowed humans to convey ideas, emotions, and stories across time and space. But what makes writing ""good""? Is it the use of language? The structure of the piece? The content? In this essay, we will explore the different elements that make up good writing.

Firstly, good writing must have a clear and concise message. It should be easy for the reader to understand what the writer is trying to convey. The message should be communicated effectively and efficiently. This means that the writer should avoid using convoluted sentences or complex vocabulary that might confuse the reader. Instead, the language should be simple and straightforward, with the purpose of the piece being clearly stated.

Secondly, good writing should be engaging. It should capture the reader's attention and maintain their interest throughout the piece. This can be achieved through the use of descriptive language, vivid imagery, and interesting characters or plotlines. The writer should strive to create a piece that is not only informative, but also entertaining and enjoyable to read.

Thirdly, good writing should be well-organized. The structure of the piece should be logical and easy to follow. This means that the writer should use headings, subheadings, and paragraphs to break up the text and guide the reader through the piece. Additionally, the writer should use transitions to connect ideas and ensure that the piece flows smoothly.

Fourthly, good writing should be appropriate for the intended audience. The tone and language used in the piece should be tailored to the readership. For example, a scientific paper might use technical language and be aimed at a specialized audience, while a children's book would use simple language and be aimed at a younger audience. The writer should consider who their audience is and adjust their writing style accordingly.

Finally, good writing should be well-edited. The writer should ensure that the piece is free of grammatical errors, spelling mistakes, and typos. This not only makes the piece easier to read, but also demonstrates the writer's attention to detail and professionalism.

Some may argue that good writing is subjective and varies from person to person. While it is true that different people may have different preferences when it comes to writing style or content, there are certain universal elements that make up good writing. Clear communication, engagement, organization, appropriateness, and editing are all key factors that contribute to good writing.

Additionally, good writing has the power to influence and inspire. It can spark ideas, ignite passions, and bring about change. Good writing can be used to tell stories, educate, and share knowledge. It can be used to convey emotions and provoke thought. In this way, good writing is a powerful tool that has the ability to impact society in a meaningful way.

On the other hand, bad writing can be detrimental. It can be confusing, boring, and frustrating to read. It can cause misunderstandings and miscommunications. Poorly written documents can lead to legal or financial repercussions. In this way, bad writing can have a negative impact on individuals and society as a whole.

Furthermore, good writing is not only important in the academic and professional spheres, but also in our everyday lives. We use writing to communicate with our friends and family, to express our thoughts and feelings, and to record our memories. Good writing can make these everyday interactions more meaningful and enjoyable.

In conclusion, good writing is a combination of clear communication, engagement, organization, appropriateness, and editing. It is a powerful tool that has the ability to influence and inspire. Good writing is not only important in academic and professional settings, but also in our everyday lives. It is a skill that can be developed and honed over time, with practice and dedication.

Moreover, good writing can be a reflection of a person's character and values. A writer who puts effort into their writing and strives for excellence may also demonstrate these qualities in other areas of their life. Good writing can also show empathy and understanding, as the writer seeks to connect with their readers and convey their message effectively.

In contrast, bad writing can be a reflection of laziness, carelessness, or lack of skill. It can show a disregard for the reader's time and attention, and a lack of respect for the importance of clear communication. Bad writing can also be a missed opportunity to share important information, inspire others, or make a positive impact.

In conclusion, good writing is an essential skill that is important in both professional and personal contexts. It is a combination of clear communication, engagement, organization, appropriateness, and editing, and has the power to influence and inspire. As such, it is important for individuals to strive for excellence in their writing, and for society to value and prioritize good writing as a means of effective communication and expression.",Argumentative,
